choice_0_ids	choice_0_label	choice_1_ids	choice_1_label	choice_2_ids	choice_2_label	choice_3_ids	choice_3_label	choice_4_ids	choice_4_label	form_abstract	form_title	pmid	uniq_id
D008727_induces_D009135	"<span class=""chemical"">[chemical A]</span> contributes to or plays a role in <span class=""disease"">[disease P]</span>"	D008727_induces_D009336	"<span class=""chemical"">[chemical A]</span> contributes to or plays a role in <span class=""disease"">[disease Q]</span>"	D019821_induces_D009135	"<span class=""chemical"">[chemical B]</span> contributes to or plays a role in <span class=""disease"">[disease P]</span>"	D019821_induces_D009336	"<span class=""chemical"">[chemical B]</span> contributes to or plays a role in <span class=""disease"">[disease Q]</span>"	D011239_induces_D009135	"<span class=""chemical"">[chemical C]</span> contributes to or plays a role in <span class=""disease"">[disease P]</span>"	"<span class=""chemical"">[chemical B]</span> can cause a necrotizing <span class=""disease"">[disease P]</span> and hyperCKaemia which is reversible on cessation of the drug. What is less well known is a phenomenon whereby <span class=""chemical"">[chemical B]</span> may induce a <span class=""disease"">[disease P]</span>, which persists or may progress after stopping the drug. We investigated the muscle pathology in 8 such cases. All had myofibre <span class=""disease"">[disease Q]</span> but only 3 had an inflammatory infiltrate. In all cases there was diffuse or multifocal up-regulation of MHC-I expression even in non-<span class=""disease"">[disease Q]</span> fibres. Progressive improvement occurred in 7 cases after commencement of <span class=""chemical"">[chemical C]</span> and <span class=""chemical"">[chemical A]</span>, and in one case spontaneously. These observations suggest that <span class=""chemical"">[chemical B]</span> may initiate an immune-mediated <span class=""disease"">[disease P]</span> that persists after withdrawal of the drug and responds to immunosuppressive therapy. The mechanism of this <span class=""disease"">[disease P]</span> is uncertain but may involve the induction by <span class=""chemical"">[chemical B]</span> of an endoplasmic reticulum stress response with associated up-regulation of MHC-I expression and antigen presentation by muscle fibres."	"Progressive <span class=""disease"">[disease P]</span> with up-regulation of MHC-I associated with <span class=""chemical"">[chemical B]</span> therapy."	17241784	bcv_id_17
D011239_induces_D009336	"<span class=""chemical"">[chemical C]</span> contributes to or plays a role in <span class=""disease"">[disease Q]</span>"	empty	<strong>Do not</strong> choose this choice.	empty	<strong>Do not</strong> choose this choice.	empty	<strong>Do not</strong> choose this choice.	empty	<strong>Do not</strong> choose this choice.	"Statins can cause a necrotizing myopathy and hyperCKaemia which is reversible on cessation of the drug. What is less well known is a phenomenon whereby statins may induce a myopathy, which persists or may progress after stopping the drug. We investigated the muscle pathology in 8 such cases. All had myofibre <span class=""disease"">[disease Q]</span> but only 3 had an inflammatory infiltrate. In all cases there was diffuse or multifocal up-regulation of MHC-I expression even in non-<span class=""disease"">[disease Q]</span> fibres. Progressive improvement occurred in 7 cases after commencement of <span class=""chemical"">[chemical C]</span> and methotrexate, and in one case spontaneously. These observations suggest that statins may initiate an immune-mediated myopathy that persists after withdrawal of the drug and responds to immunosuppressive therapy. The mechanism of this myopathy is uncertain but may involve the induction by statins of an endoplasmic reticulum stress response with associated up-regulation of MHC-I expression and antigen presentation by muscle fibres."	Progressive myopathy with up-regulation of MHC-I associated with statin therapy.	17241784	bcv_id_18
C009265_induces_D001523	"<span class=""chemical"">[chemical A]</span> contributes to or plays a role in <span class=""disease"">[disease P]</span>"	C009265_induces_D012640	"<span class=""chemical"">[chemical A]</span> contributes to or plays a role in <span class=""disease"">[disease Q]</span>"	C009265_induces_D004827	"<span class=""chemical"">[chemical A]</span> contributes to or plays a role in <span class=""disease"">[disease R]</span>"	C009265_induces_D007676	"<span class=""chemical"">[chemical A]</span> contributes to or plays a role in <span class=""disease"">[disease S]</span>"	D025101_induces_D001523	"<span class=""chemical"">[chemical B]</span> contributes to or plays a role in <span class=""disease"">[disease P]</span>"	"Two patients with similar clinical features are presented: both patients had <span class=""disease"">[disease S]</span>, on hemodialysis for many years but recently begun on a high-flux dialyzer; both had been receiving a <span class=""chemical"">[chemical A]</span> preparation; and both had the onset of <span class=""disease"">[disease P]</span> and recurrent <span class=""disease"">[disease Q]</span>, which were refractory to anticonvulsants. The first patient died without a diagnosis; the second patient had a dramatic recovery following the administration of <span class=""chemical"">[chemical B]</span>. Neither patient was considered to have a renal state sufficiently severe enough to explain their presentation."	"Serial <span class=""disease"">[disease R]</span> caused by <span class=""chemical"">[chemical A]</span> administration in two patients on hemodialysis."	2265898	bcv_id_19
D025101_induces_D012640	"<span class=""chemical"">[chemical B]</span> contributes to or plays a role in <span class=""disease"">[disease Q]</span>"	D025101_induces_D004827	"<span class=""chemical"">[chemical B]</span> contributes to or plays a role in <span class=""disease"">[disease R]</span>"	D025101_induces_D007676	"<span class=""chemical"">[chemical B]</span> contributes to or plays a role in <span class=""disease"">[disease S]</span>"	empty	<strong>Do not</strong> choose this choice.	empty	<strong>Do not</strong> choose this choice.	"Two patients with similar clinical features are presented: both patients had <span class=""disease"">[disease S]</span>, on hemodialysis for many years but recently begun on a high-flux dialyzer; both had been receiving a carbidopa/levodopa preparation; and both had the onset of hallucinosis and recurrent <span class=""disease"">[disease Q]</span>, which were refractory to anticonvulsants. The first patient died without a diagnosis; the second patient had a dramatic recovery following the administration of <span class=""chemical"">[chemical B]</span>. Neither patient was considered to have a renal state sufficiently severe enough to explain their presentation."	"Serial <span class=""disease"">[disease R]</span> caused by levodopa/carbidopa administration in two patients on hemodialysis."	2265898	bcv_id_20
D010396_induces_D001018	"<span class=""chemical"">[chemical A]</span> contributes to or plays a role in <span class=""disease"">[disease P]</span>"	D006820_induces_D001018	"<span class=""chemical"">[chemical B]</span> contributes to or plays a role in <span class=""disease"">[disease P]</span>"	empty	<strong>Do not</strong> choose this choice.	empty	<strong>Do not</strong> choose this choice.	empty	<strong>Do not</strong> choose this choice.	"Male Sprague-Dawley rats were treated with <span class=""chemical"">[chemical A]</span> (<span class=""chemical"">[chemical A]</span>) 500 mg/kg/day for 10 or 42 days. Pair fed rats served as controls. Changes in aortic morphology were examined by light- and transmission-electron microscopy (TEM). In addition, the endothelial permeability and the penetration through the aortic wall of albumin were studied 10 minutes, 24 and 48 hours after i. v. injection of human serum 131I-albumin (131I-HSA). TEM revealed extensive elastolysis in the arterial wall of <span class=""chemical"">[chemical A]</span>-treated rats, consistent with an inhibitory effect on crosslink formation. In experimental animals excess deposition of collagen and glycoaminoglycans was observed in the subendothelial and medial layer of the aortic wall, together with prominent basal membrane substance around aortic smooth muscle cells. The aorta/serum-ratio and the radioactive build-up 24 and 48 hours after injection of 131I-HSA was reduced in animals treated with <span class=""chemical"">[chemical A]</span> for 42 days, indicating an impeded transmural transport of tracer which may be caused by a steric exclusion effect of abundant <span class=""chemical"">[chemical B]</span>. The endothelial ultrastructure was unaffected by <span class=""chemical"">[chemical A]</span>, and no differences in aortic 131I-HSA radioactivity or aorta/serum-ratio were recorded between experimental and control groups 10 minutes after tracer injection, indicating that the permeability of the endothelial barrier to albumin remained unaffected by <span class=""chemical"">[chemical A]</span> treatment. These observations support the hypothesis that treatment with high doses of <span class=""chemical"">[chemical A]</span> may induce a fibroproliferative response in rat aorta, possibly by an inhibitory effect on the cross-linking of collagen and elastin."	"<span class=""chemical"">[chemical A]</span>-induced <span class=""disease"">[disease P]</span> in rats. The effect of high dose <span class=""chemical"">[chemical A]</span> treatment on aortic permeability to albumin and on the ultrastructure of the vessel."	6666578	bcv_id_21
D002857_induces_D006333	"<span class=""chemical"">[chemical A]</span> contributes to or plays a role in <span class=""disease"">[disease P]</span>"	D002857_induces_D006947	"<span class=""chemical"">[chemical A]</span> contributes to or plays a role in <span class=""disease"">[disease Q]</span>"	D002857_induces_D003920	"<span class=""chemical"">[chemical A]</span> contributes to or plays a role in <span class=""disease"">[disease R]</span>"	D002857_induces_D051437	"<span class=""chemical"">[chemical A]</span> contributes to or plays a role in <span class=""disease"">[disease S]</span>"	D003404_induces_D006333	"<span class=""chemical"">[chemical B]</span> contributes to or plays a role in <span class=""disease"">[disease P]</span>"	"<p>BACKGROUND: A previous randomized controlled trial evaluating the use of spironolactone in <span class=""disease"">[disease P]</span> patients reported a low risk of <span class=""disease"">[disease Q]</span> (2%) and <span class=""disease"">[disease S]</span> (0%). Because treatments for <span class=""disease"">[disease P]</span> have changed since the benefits of spironolactone were reported, the prevalence of these complications may differ in current clinical practice. We therefore sought to determine the prevalence and clinical associations of <span class=""disease"">[disease Q]</span> and <span class=""disease"">[disease S]</span> in <span class=""disease"">[disease P]</span> patients treated with spironolactone. </p><p>METHODS: We performed a case control study of <span class=""disease"">[disease P]</span> patients treated with spironolactone in our clinical practice. Cases were patients who developed <span class=""disease"">[disease Q]</span> (K(+) >5.0 mEq/L) or <span class=""disease"">[disease S]</span> (<span class=""chemical"">[chemical A]</span> >or=2.5 mg/dL), and they were compared to 2 randomly selected controls per case. Clinical characteristics, medications, and serum chemistries at baseline and follow-up time periods were compared. </p><p>RESULTS: Sixty-seven of 926 patients (7.2%) required discontinuation of spironolactone due to <span class=""disease"">[disease Q]</span> (n = 33) or <span class=""disease"">[disease S]</span> (n = 34). Patients who developed <span class=""disease"">[disease Q]</span> were older and more likely to have <span class=""disease"">[disease R]</span>, had higher baseline serum potassium levels and lower baseline potassium supplement doses, and were more likely to be treated with beta-blockers than controls (n = 134). Patients who developed <span class=""disease"">[disease S]</span> had lower baseline body weight and higher baseline serum <span class=""chemical"">[chemical B]</span>, required higher doses of loop diuretics, and were more likely to be treated with thiazide diuretics than controls. </p><p>CONCLUSIONS: Spironolactone-induced <span class=""disease"">[disease Q]</span> and <span class=""disease"">[disease S]</span> are more common in our clinical experience than reported previously. This difference is explained by patient comorbidities and more frequent use of beta-blockers.</p>"	"Spironolactone-induced <span class=""disease"">[disease S]</span> and <span class=""disease"">[disease Q]</span> in patients with <span class=""disease"">[disease P]</span>."	15632880	bcv_id_22
D003404_induces_D006947	"<span class=""chemical"">[chemical B]</span> contributes to or plays a role in <span class=""disease"">[disease Q]</span>"	D003404_induces_D003920	"<span class=""chemical"">[chemical B]</span> contributes to or plays a role in <span class=""disease"">[disease R]</span>"	D003404_induces_D051437	"<span class=""chemical"">[chemical B]</span> contributes to or plays a role in <span class=""disease"">[disease S]</span>"	D011188_induces_D006333	"<span class=""chemical"">[chemical C]</span> contributes to or plays a role in <span class=""disease"">[disease P]</span>"	D011188_induces_D006947	"<span class=""chemical"">[chemical C]</span> contributes to or plays a role in <span class=""disease"">[disease Q]</span>"	"<p>BACKGROUND: A previous randomized controlled trial evaluating the use of spironolactone in <span class=""disease"">[disease P]</span> patients reported a low risk of <span class=""disease"">[disease Q]</span> (2%) and <span class=""disease"">[disease S]</span> (0%). Because treatments for <span class=""disease"">[disease P]</span> have changed since the benefits of spironolactone were reported, the prevalence of these complications may differ in current clinical practice. We therefore sought to determine the prevalence and clinical associations of <span class=""disease"">[disease Q]</span> and <span class=""disease"">[disease S]</span> in <span class=""disease"">[disease P]</span> patients treated with spironolactone. </p><p>METHODS: We performed a case control study of <span class=""disease"">[disease P]</span> patients treated with spironolactone in our clinical practice. Cases were patients who developed <span class=""disease"">[disease Q]</span> (<span class=""chemical"">[chemical C]</span>(+) >5.0 mEq/L) or <span class=""disease"">[disease S]</span> (Cr >or=2.5 mg/dL), and they were compared to 2 randomly selected controls per case. Clinical characteristics, medications, and serum chemistries at baseline and follow-up time periods were compared. </p><p>RESULTS: Sixty-seven of 926 patients (7.2%) required discontinuation of spironolactone due to <span class=""disease"">[disease Q]</span> (n = 33) or <span class=""disease"">[disease S]</span> (n = 34). Patients who developed <span class=""disease"">[disease Q]</span> were older and more likely to have <span class=""disease"">[disease R]</span>, had higher baseline serum <span class=""chemical"">[chemical C]</span> levels and lower baseline <span class=""chemical"">[chemical C]</span> supplement doses, and were more likely to be treated with beta-blockers than controls (n = 134). Patients who developed <span class=""disease"">[disease S]</span> had lower baseline body weight and higher baseline serum <span class=""chemical"">[chemical B]</span>, required higher doses of loop diuretics, and were more likely to be treated with thiazide diuretics than controls. </p><p>CONCLUSIONS: Spironolactone-induced <span class=""disease"">[disease Q]</span> and <span class=""disease"">[disease S]</span> are more common in our clinical experience than reported previously. This difference is explained by patient comorbidities and more frequent use of beta-blockers.</p>"	"Spironolactone-induced <span class=""disease"">[disease S]</span> and <span class=""disease"">[disease Q]</span> in patients with <span class=""disease"">[disease P]</span>."	15632880	bcv_id_23
D011188_induces_D003920	"<span class=""chemical"">[chemical C]</span> contributes to or plays a role in <span class=""disease"">[disease R]</span>"	D011188_induces_D051437	"<span class=""chemical"">[chemical C]</span> contributes to or plays a role in <span class=""disease"">[disease S]</span>"	D049971_induces_D006333	"<span class=""chemical"">[chemical D]</span> contributes to or plays a role in <span class=""disease"">[disease P]</span>"	D049971_induces_D006947	"<span class=""chemical"">[chemical D]</span> contributes to or plays a role in <span class=""disease"">[disease Q]</span>"	D049971_induces_D003920	"<span class=""chemical"">[chemical D]</span> contributes to or plays a role in <span class=""disease"">[disease R]</span>"	"<p>BACKGROUND: A previous randomized controlled trial evaluating the use of spironolactone in <span class=""disease"">[disease P]</span> patients reported a low risk of <span class=""disease"">[disease Q]</span> (2%) and <span class=""disease"">[disease S]</span> (0%). Because treatments for <span class=""disease"">[disease P]</span> have changed since the benefits of spironolactone were reported, the prevalence of these complications may differ in current clinical practice. We therefore sought to determine the prevalence and clinical associations of <span class=""disease"">[disease Q]</span> and <span class=""disease"">[disease S]</span> in <span class=""disease"">[disease P]</span> patients treated with spironolactone. </p><p>METHODS: We performed a case control study of <span class=""disease"">[disease P]</span> patients treated with spironolactone in our clinical practice. Cases were patients who developed <span class=""disease"">[disease Q]</span> (<span class=""chemical"">[chemical C]</span>(+) >5.0 mEq/L) or <span class=""disease"">[disease S]</span> (Cr >or=2.5 mg/dL), and they were compared to 2 randomly selected controls per case. Clinical characteristics, medications, and serum chemistries at baseline and follow-up time periods were compared. </p><p>RESULTS: Sixty-seven of 926 patients (7.2%) required discontinuation of spironolactone due to <span class=""disease"">[disease Q]</span> (n = 33) or <span class=""disease"">[disease S]</span> (n = 34). Patients who developed <span class=""disease"">[disease Q]</span> were older and more likely to have <span class=""disease"">[disease R]</span>, had higher baseline serum <span class=""chemical"">[chemical C]</span> levels and lower baseline <span class=""chemical"">[chemical C]</span> supplement doses, and were more likely to be treated with beta-blockers than controls (n = 134). Patients who developed <span class=""disease"">[disease S]</span> had lower baseline body weight and higher baseline serum creatinine, required higher doses of loop diuretics, and were more likely to be treated with <span class=""chemical"">[chemical D]</span> diuretics than controls. </p><p>CONCLUSIONS: Spironolactone-induced <span class=""disease"">[disease Q]</span> and <span class=""disease"">[disease S]</span> are more common in our clinical experience than reported previously. This difference is explained by patient comorbidities and more frequent use of beta-blockers.</p>"	"Spironolactone-induced <span class=""disease"">[disease S]</span> and <span class=""disease"">[disease Q]</span> in patients with <span class=""disease"">[disease P]</span>."	15632880	bcv_id_24
D049971_induces_D051437	"<span class=""chemical"">[chemical D]</span> contributes to or plays a role in <span class=""disease"">[disease S]</span>"	D013148_induces_D006333	"<span class=""chemical"">[chemical E]</span> contributes to or plays a role in <span class=""disease"">[disease P]</span>"	D013148_induces_D006947	"<span class=""chemical"">[chemical E]</span> contributes to or plays a role in <span class=""disease"">[disease Q]</span>"	D013148_induces_D003920	"<span class=""chemical"">[chemical E]</span> contributes to or plays a role in <span class=""disease"">[disease R]</span>"	D013148_induces_D051437	"<span class=""chemical"">[chemical E]</span> contributes to or plays a role in <span class=""disease"">[disease S]</span>"	"<p>BACKGROUND: A previous randomized controlled trial evaluating the use of <span class=""chemical"">[chemical E]</span> in <span class=""disease"">[disease P]</span> patients reported a low risk of <span class=""disease"">[disease Q]</span> (2%) and <span class=""disease"">[disease S]</span> (0%). Because treatments for <span class=""disease"">[disease P]</span> have changed since the benefits of <span class=""chemical"">[chemical E]</span> were reported, the prevalence of these complications may differ in current clinical practice. We therefore sought to determine the prevalence and clinical associations of <span class=""disease"">[disease Q]</span> and <span class=""disease"">[disease S]</span> in <span class=""disease"">[disease P]</span> patients treated with <span class=""chemical"">[chemical E]</span>. </p><p>METHODS: We performed a case control study of <span class=""disease"">[disease P]</span> patients treated with <span class=""chemical"">[chemical E]</span> in our clinical practice. Cases were patients who developed <span class=""disease"">[disease Q]</span> (K(+) >5.0 mEq/L) or <span class=""disease"">[disease S]</span> (Cr >or=2.5 mg/dL), and they were compared to 2 randomly selected controls per case. Clinical characteristics, medications, and serum chemistries at baseline and follow-up time periods were compared. </p><p>RESULTS: Sixty-seven of 926 patients (7.2%) required discontinuation of <span class=""chemical"">[chemical E]</span> due to <span class=""disease"">[disease Q]</span> (n = 33) or <span class=""disease"">[disease S]</span> (n = 34). Patients who developed <span class=""disease"">[disease Q]</span> were older and more likely to have <span class=""disease"">[disease R]</span>, had higher baseline serum potassium levels and lower baseline potassium supplement doses, and were more likely to be treated with beta-blockers than controls (n = 134). Patients who developed <span class=""disease"">[disease S]</span> had lower baseline body weight and higher baseline serum creatinine, required higher doses of loop diuretics, and were more likely to be treated with <span class=""chemical"">[chemical D]</span> diuretics than controls. </p><p>CONCLUSIONS: <span class=""chemical"">[chemical E]</span>-induced <span class=""disease"">[disease Q]</span> and <span class=""disease"">[disease S]</span> are more common in our clinical experience than reported previously. This difference is explained by patient comorbidities and more frequent use of beta-blockers.</p>"	"<span class=""chemical"">[chemical E]</span>-induced <span class=""disease"">[disease S]</span> and <span class=""disease"">[disease Q]</span> in patients with <span class=""disease"">[disease P]</span>."	15632880	bcv_id_25
C016986_induces_D015878	"<span class=""chemical"">[chemical A]</span> contributes to or plays a role in <span class=""disease"">[disease P]</span>"	C016986_induces_D003316	"<span class=""chemical"">[chemical A]</span> contributes to or plays a role in <span class=""disease"">[disease Q]</span>"	C016986_induces_D003229	"<span class=""chemical"">[chemical A]</span> contributes to or plays a role in <span class=""disease"">[disease R]</span>"	C016986_induces_D007022	"<span class=""chemical"">[chemical A]</span> contributes to or plays a role in <span class=""disease"">[disease S]</span>"	C016986_induces_D015814	"<span class=""chemical"">[chemical A]</span> contributes to or plays a role in <span class=""disease"">[disease T]</span>"	"We prospectively evaluated the adverse reactions of <span class=""chemical"">[chemical A]</span> in 20 normal volunteers by instilling a single drop of 1% <span class=""chemical"">[chemical A]</span> in their right eyes. Examinations, including blood pressure, pulse rate, conjunctiva and cornea, intraocular pressure (IOP), pupil diameter, basal tear secretion and margin reflex distance of both upper and lower eyelids, were performed prior to entry and at 1, 3, 5 and 7 hours after instillation. The <span class=""disease"">[disease T]</span> effects were statistically significant for <span class=""chemical"">[chemical A]</span>-treated eyes throughout the study and also statistically significant for contralateral eyes from three hours after topical administration of 1% <span class=""chemical"">[chemical A]</span>. <span class=""disease"">[disease S]</span> were statistically, but not clinically, significant. No significant changes in diastolic blood pressure, pulse rate and basal tear secretion were noted. <span class=""disease"">[disease R]</span> and <span class=""disease"">[disease P]</span> were commonly found. Upper lid retraction was frequently noted. While the elevations of the upper lid margin in most subjects were not more than 2 mm and did not cause noticeable change in appearance, one subject suffered from mechanical entropion and marked <span class=""disease"">[disease Q]</span> 3 hours after instillation of the medication. This may well be a particularly notable finding in Asian people."	"Evaluation of adverse reactions of <span class=""chemical"">[chemical A]</span> ophthalmic solution."	8590259	bcv_id_26
