choice_0_ids	choice_0_label	choice_1_ids	choice_1_label	choice_2_ids	choice_2_label	choice_3_ids	choice_3_label	choice_4_ids	choice_4_label	form_abstract	form_title	pmid	uniq_id
D008094_induces_D007676	"<span class=""chemical"">[chemical B]</span> contributes to or plays a role in <span class=""disease"">[disease T]</span>"	D008094_induces_D005921	"<span class=""chemical"">[chemical B]</span> contributes to or plays a role in <span class=""disease"">[disease U]</span>"	empty	<strong>Do not</strong> choose this choice.	empty	<strong>Do not</strong> choose this choice.	empty	<strong>Do not</strong> choose this choice.	"Rats with <span class=""chemical"">[chemical B]</span>-induced nephropathy were subjected to high protein (HP) feeding, uninephrectomy (NX) or a combination of these, in an attempt to induce glomerular hyperfiltration and further progression of renal failure. Newborn female Wistar rats were fed a <span class=""chemical"">[chemical B]</span>-containing diet (50 mmol/kg) for 8 weeks and then randomized to normal diet, HP diet (40 vs. 19%), NX or HP+NX for another 8 weeks. Corresponding non-<span class=""chemical"">[chemical B]</span> pretreated groups were generated. When comparing all <span class=""chemical"">[chemical B]</span> treated versus non-<span class=""chemical"">[chemical B]</span>-treated groups, <span class=""chemical"">[chemical B]</span> caused a reduction in glomerular filtration rate (GFR) without significant changes in effective renal plasma flow (as determined by a marker secreted into the proximal tubules) or <span class=""chemical"">[chemical B]</span> clearance. Consequently, <span class=""chemical"">[chemical B]</span> pretreatment caused a fall in filtration fraction and an increase in fractional <span class=""chemical"">[chemical B]</span> excretion. <span class=""chemical"">[chemical B]</span> also caused proteinuria and systolic hypertension in absence of <span class=""disease"">[disease U]</span>. HP failed to accentuante progression of renal failure and in fact tended to increase GFR and decrease plasma creatinine levels in <span class=""chemical"">[chemical B]</span> pretreated rats. NX caused an additive deterioration in GFR which, however, was ameliorated by HP. NX+HP caused a further rise in blood pressure in <span class=""chemical"">[chemical B]</span>-pretreated rats. The results indicate that <span class=""chemical"">[chemical B]</span>-induced nephropathy, even when the GFR is only modestly reduced, is associated with proteinuria and arterial systolic hypertension. In this model of <span class=""disease"">[disease T]</span> the decline in GFR is not accompanied by a corresponding fall in effective renal plasma flow, which may be the functional expression of the formation of nonfiltrating atubular glomeruli. The fractional reabsorption of tubular fluid by the proximal tubules is reduced, leaving the distal delivery unchanged.(ABSTRACT TRUNCATED AT 250 WORDS)"	"Effects of uninephrectomy and high protein feeding on <span class=""chemical"">[chemical B]</span>-induced <span class=""disease"">[disease T]</span> in rats."	1378968	bcv_id_7
D002211_induces_D010146	"<span class=""chemical"">[chemical A]</span> contributes to or plays a role in <span class=""disease"">[disease P]</span>"	empty	<strong>Do not</strong> choose this choice.	empty	<strong>Do not</strong> choose this choice.	empty	<strong>Do not</strong> choose this choice.	empty	<strong>Do not</strong> choose this choice.	"<span class=""disease"">[disease P]</span> memory is thought to affect future <span class=""disease"">[disease P]</span> sensitivity and thus contribute to clinical <span class=""disease"">[disease P]</span> conditions. Systematic investigations of the human capacity to remember sensory features of experimental <span class=""disease"">[disease P]</span> are sparse. In order to address long-term <span class=""disease"">[disease P]</span> memory, nine healthy male volunteers received intradermal injections of three doses of <span class=""chemical"">[chemical A]</span> (0.05, 1 and 20 microg, separated by 15 min breaks), each given three times in a balanced design across three sessions at one week intervals. <span class=""disease"">[disease P]</span> rating was performed using a computerized visual analogue scale (0-100) digitized at 1/s, either immediately online or one hour or one day after injection. Subjects also recalled their <span class=""disease"">[disease P]</span> one week later. <span class=""chemical"">[chemical A]</span> injection reliably induced a dose-dependent flare (p<0.001) without any difference within or across sessions. The strong burning <span class=""disease"">[disease P]</span> decayed exponentially within a few minutes. Subjects were able to reliably discriminate <span class=""disease"">[disease P]</span> magnitude and duration across <span class=""chemical"">[chemical A]</span> doses (both p<0.001), regardless of whether first-time ratings were requested immediately, after one hour or after one day. <span class=""disease"">[disease P]</span> recall after one week was similarly precise (magnitude: p<0.01, duration: p<0.05). Correlation with rating recall after one week was best when first-time ratings were requested as late as one day after injection (R(2)=0.79) indicating that both rating retrievals utilized similar memory traces. These results indicate a reliable memory for magnitude and duration of experimentally induced <span class=""disease"">[disease P]</span>. The data further suggest that the consolidation of this memory is an important interim stage, and may take up to one day."	"Explicit episodic memory for sensory-discriminative components of <span class=""chemical"">[chemical A]</span>-induced <span class=""disease"">[disease P]</span>: immediate and delayed ratings."	19269743	bcv_id_8
D015742_induces_D010146	"<span class=""chemical"">[chemical A]</span> contributes to or plays a role in <span class=""disease"">[disease P]</span>"	D015742_induces_D014474	"<span class=""chemical"">[chemical A]</span> contributes to or plays a role in <span class=""disease"">[disease Q]</span>"	D013874_induces_D010146	"<span class=""chemical"">[chemical B]</span> contributes to or plays a role in <span class=""disease"">[disease P]</span>"	D013874_induces_D014474	"<span class=""chemical"">[chemical B]</span> contributes to or plays a role in <span class=""disease"">[disease Q]</span>"	D008012_induces_D010146	"<span class=""chemical"">[chemical C]</span> contributes to or plays a role in <span class=""disease"">[disease P]</span>"	"This study investigated <span class=""chemical"">[chemical A]</span> injection <span class=""disease"">[disease P]</span> in patients undergoing ambulatory anaesthesia. In a randomized, double-blind trial, 90 women were allocated to receive one of three treatments prior to induction of anaesthesia with <span class=""chemical"">[chemical A]</span>. Patients in Group C received 2 ml normal saline, Group L, 2 ml, <span class=""chemical"">[chemical C]</span> 2% (40 mg) and Group T, 2 ml <span class=""chemical"">[chemical B]</span> 2.5% (50 mg). Venous discomfort was assessed with a visual analogue scale (VAS) 5-15 sec after commencing <span class=""chemical"">[chemical A]</span> administration using an infusion pump (rate 1000 micrograms.kg-1.min-1). <span class=""disease"">[disease Q]</span> occurred in 60-90 sec. Visual analogue scores (mean +/- SD) during induction were lower in Groups L (3.3 +/- 2.5) and T (4.1 +/- 2.7) than in Group C (5.6 +/- 2.3); P = 0.0031. The incidence of venous discomfort was lower in Group L (76.6%; P < 0.05) than in Group C (100%) but not different from Group T (90%). The VAS scores for recall of <span class=""disease"">[disease P]</span> in the recovery room were correlated with the VAS scores during induction (r = 0.7045; P < 0.0001). Recovery room discharge times were similar: C (75.9 +/- 19.4 min); L 73.6 +/- 21.6 min); T (77.1 +/- 18.9 min). Assessing their overall satisfaction, 89.7% would choose <span class=""chemical"">[chemical A]</span> anaesthesia again. We conclude that <span class=""chemical"">[chemical C]</span> reduces the incidence and severity of <span class=""chemical"">[chemical A]</span> injection <span class=""disease"">[disease P]</span> in ambulatory patients whereas <span class=""chemical"">[chemical B]</span> only reduces its severity."	"<span class=""chemical"">[chemical B]</span> pretreatment for <span class=""chemical"">[chemical A]</span> injection <span class=""disease"">[disease P]</span> in ambulatory patients."	8595686	bcv_id_9
D008012_induces_D014474	"<span class=""chemical"">[chemical C]</span> contributes to or plays a role in <span class=""disease"">[disease Q]</span>"	empty	<strong>Do not</strong> choose this choice.	empty	<strong>Do not</strong> choose this choice.	empty	<strong>Do not</strong> choose this choice.	empty	<strong>Do not</strong> choose this choice.	"This study investigated propofol injection pain in patients undergoing ambulatory anaesthesia. In a randomized, double-blind trial, 90 women were allocated to receive one of three treatments prior to induction of anaesthesia with propofol. Patients in Group C received 2 ml normal saline, Group L, 2 ml, <span class=""chemical"">[chemical C]</span> 2% (40 mg) and Group T, 2 ml thiopentone 2.5% (50 mg). Venous discomfort was assessed with a visual analogue scale (VAS) 5-15 sec after commencing propofol administration using an infusion pump (rate 1000 micrograms.kg-1.min-1). <span class=""disease"">[disease Q]</span> occurred in 60-90 sec. Visual analogue scores (mean +/- SD) during induction were lower in Groups L (3.3 +/- 2.5) and T (4.1 +/- 2.7) than in Group C (5.6 +/- 2.3); P = 0.0031. The incidence of venous discomfort was lower in Group L (76.6%; P < 0.05) than in Group C (100%) but not different from Group T (90%). The VAS scores for recall of pain in the recovery room were correlated with the VAS scores during induction (r = 0.7045; P < 0.0001). Recovery room discharge times were similar: C (75.9 +/- 19.4 min); L 73.6 +/- 21.6 min); T (77.1 +/- 18.9 min). Assessing their overall satisfaction, 89.7% would choose propofol anaesthesia again. We conclude that <span class=""chemical"">[chemical C]</span> reduces the incidence and severity of propofol injection pain in ambulatory patients whereas thiopentone only reduces its severity."	Thiopentone pretreatment for propofol injection pain in ambulatory patients.	8595686	bcv_id_10
D010862_induces_D013226	"<span class=""chemical"">[chemical A]</span> contributes to or plays a role in <span class=""disease"">[disease P]</span>"	D010862_induces_D003643	"<span class=""chemical"">[chemical A]</span> contributes to or plays a role in <span class=""disease"">[disease Q]</span>"	D010862_induces_D028361	"<span class=""chemical"">[chemical A]</span> contributes to or plays a role in <span class=""disease"">[disease R]</span>"	D010862_induces_D004827	"<span class=""chemical"">[chemical A]</span> contributes to or plays a role in <span class=""disease"">[disease S]</span>"	D010862_induces_D004833	"<span class=""chemical"">[chemical A]</span> contributes to or plays a role in <span class=""disease"">[disease T]</span>"	"<span class=""disease"">[disease R]</span> have been associated with several aspects of epileptogenesis, such as energy generation, control of cell <span class=""disease"">[disease Q]</span>, neurotransmitter synthesis, and free radical (FR) production. Increased production of FRs may cause mtDNA damage leading to decreased activities of oxidative phosphorylation complexes containing mtDNA-encoded subunits. In this study, we investigated whether increased generation of FR during <span class=""disease"">[disease P]</span> would be sufficient to provoke abnormalities in mtDNA and in the expression and activity of cytochrome c oxidase (CCO), complex IV of the respiratory chain, in the chronic phase of the <span class=""chemical"">[chemical A]</span> model of <span class=""disease"">[disease T]</span>. DNA analysis revealed low amounts of a 4.8 kb mtDNA deletion but with no differences in frequency or quantity in the control and experimental groups. We did not find abnormalities in the expression and distribution of an mtDNA-encoded subunit of CCO (CCO-I) or a relative decrease in CCO-I when compared with nuclear-encoded subunits (CCO-IV and SDH-fp). No abnormality in CCO activity was observed through histochemistry. Although evidences of <span class=""disease"">[disease R]</span> were found in previously published studies, our results do not suggest that the FRs, generated during the acute phase, determined important abnormalities in mtDNA, in expression of CCO-I, and in CCO activity."	"Investigation of mitochondrial involvement in the experimental model of <span class=""disease"">[disease S]</span> induced by <span class=""chemical"">[chemical A]</span>."	16337777	bcv_id_11
D015742_induces_D013610	"<span class=""chemical"">[chemical A]</span> contributes to or plays a role in <span class=""disease"">[disease P]</span>"	D015742_induces_D007022	"<span class=""chemical"">[chemical A]</span> contributes to or plays a role in <span class=""disease"">[disease Q]</span>"	D015742_induces_D017202	"<span class=""chemical"">[chemical A]</span> contributes to or plays a role in <span class=""disease"">[disease R]</span>"	D004809_induces_D013610	"<span class=""chemical"">[chemical B]</span> contributes to or plays a role in <span class=""disease"">[disease P]</span>"	D004809_induces_D007022	"<span class=""chemical"">[chemical B]</span> contributes to or plays a role in <span class=""disease"">[disease Q]</span>"	"The marked vasodilator and negative inotropic effects of <span class=""chemical"">[chemical A]</span> are disadvantages in frail elderly patients. We investigated the safety and efficacy of adding different doses of <span class=""chemical"">[chemical B]</span> to <span class=""chemical"">[chemical A]</span> in order to obtund the <span class=""disease"">[disease Q]</span> response. The haemodynamic effects of adding 15, 20 or 25 mg of <span class=""chemical"">[chemical B]</span> to 200 mg of <span class=""chemical"">[chemical A]</span> were compared to control in 40 ASA 3/4 patients over 60 years presenting for genito-urinary surgery. The addition of <span class=""chemical"">[chemical B]</span> to <span class=""chemical"">[chemical A]</span> appears to be an effective method of obtunding the <span class=""disease"">[disease Q]</span> response to <span class=""chemical"">[chemical A]</span> at all doses used in this study. However, marked <span class=""disease"">[disease P]</span> associated with the use of <span class=""chemical"">[chemical B]</span> in combination with <span class=""chemical"">[chemical A]</span> occurred in the majority of patients, occasionally reaching high levels in individual patients. Due to the risk of this <span class=""disease"">[disease P]</span> inducing <span class=""disease"">[disease R]</span>, we would not recommend the use in elderly patients of any of the <span class=""chemical"">[chemical B]</span>/<span class=""chemical"">[chemical A]</span>/mixtures studied."	"The haemodynamic effects of <span class=""chemical"">[chemical A]</span> in combination with <span class=""chemical"">[chemical B]</span> in elderly patients (ASA groups 3 and 4)."	10520387	bcv_id_12
D004809_induces_D017202	"<span class=""chemical"">[chemical B]</span> contributes to or plays a role in <span class=""disease"">[disease R]</span>"	empty	<strong>Do not</strong> choose this choice.	empty	<strong>Do not</strong> choose this choice.	empty	<strong>Do not</strong> choose this choice.	empty	<strong>Do not</strong> choose this choice.	"The marked vasodilator and negative inotropic effects of propofol are disadvantages in frail elderly patients. We investigated the safety and efficacy of adding different doses of <span class=""chemical"">[chemical B]</span> to propofol in order to obtund the hypotensive response. The haemodynamic effects of adding 15, 20 or 25 mg of <span class=""chemical"">[chemical B]</span> to 200 mg of propofol were compared to control in 40 ASA 3/4 patients over 60 years presenting for genito-urinary surgery. The addition of <span class=""chemical"">[chemical B]</span> to propofol appears to be an effective method of obtunding the hypotensive response to propofol at all doses used in this study. However, marked tachycardia associated with the use of <span class=""chemical"">[chemical B]</span> in combination with propofol occurred in the majority of patients, occasionally reaching high levels in individual patients. Due to the risk of this tachycardia inducing <span class=""disease"">[disease R]</span>, we would not recommend the use in elderly patients of any of the <span class=""chemical"">[chemical B]</span>/propofol/mixtures studied."	"The haemodynamic effects of propofol in combination with <span class=""chemical"">[chemical B]</span> in elderly patients (ASA groups 3 and 4)."	10520387	bcv_id_13
D006493_induces_D003288	"<span class=""chemical"">[chemical A]</span> contributes to or plays a role in <span class=""disease"">[disease P]</span>"	D006493_induces_D010146	"<span class=""chemical"">[chemical A]</span> contributes to or plays a role in <span class=""disease"">[disease Q]</span>"	empty	<strong>Do not</strong> choose this choice.	empty	<strong>Do not</strong> choose this choice.	empty	<strong>Do not</strong> choose this choice.	"<p>AIM: This study was carried out to determine the effect of injection duration on <span class=""disease"">[disease P]</span> and <span class=""disease"">[disease Q]</span> following the administration of the subcutaneous injection of <span class=""chemical"">[chemical A]</span>. </p><p>BACKGROUND: Although different methods to prevent <span class=""disease"">[disease P]</span> and <span class=""disease"">[disease Q]</span> following the subcutaneous injection of <span class=""chemical"">[chemical A]</span> have been widely studied and described, the effect of injection duration on the occurrence of <span class=""disease"">[disease P]</span> and <span class=""disease"">[disease Q]</span> is little documented. </p><p>DESIGN: This study was designed as within-subject, quasi-experimental research. </p><p>METHOD: The sample for the study consisted of 50 patients to whom subcutaneous <span class=""chemical"">[chemical A]</span> was administered. <span class=""chemical"">[chemical A]</span> was injected over 10 seconds on the right abdominal site and 30 seconds on the left abdominal site. Injections areas were assessed for the presence of <span class=""disease"">[disease P]</span> at 48 and 72 hours after each injection. Dimensions of the <span class=""disease"">[disease P]</span> on the <span class=""chemical"">[chemical A]</span> applied areas were measured using transparent millimetric measuring paper. The visual analog scale (VAS) was used to measure <span class=""disease"">[disease Q]</span> intensity and a stop-watch was used to time the <span class=""disease"">[disease Q]</span> period. Data were analysed using chi-square test, Mann-Whitney U, Wilcoxon signed ranks tests and correlation. </p><p>RESULTS: The percentage of <span class=""disease"">[disease P]</span> occurrence was 64% with the injection of 10 seconds duration and 42% in the 30-second injection. It was determined that the size of the <span class=""disease"">[disease P]</span> was smaller in the 30-second injection. <span class=""disease"">[disease Q]</span> intensity and <span class=""disease"">[disease Q]</span> period were statistically significantly lower for the 30-second injection than for the 10-second injection. </p><p>CONCLUSIONS: It was determined that injection duration had an effect on <span class=""disease"">[disease P]</span> and <span class=""disease"">[disease Q]</span> following the subcutaneous administration of <span class=""chemical"">[chemical A]</span>. This study should be repeated on a larger sample. </p><p>RELEVANCE TO CLINICAL PRACTICE: When administering subcutaneous <span class=""chemical"">[chemical A]</span> injections, it is important to extend the duration of the injection.</p>"	"A study on the effect of the duration of subcutaneous <span class=""chemical"">[chemical A]</span> injection on <span class=""disease"">[disease P]</span> and <span class=""disease"">[disease Q]</span>."	17931375	bcv_id_14
D010423_induces_D009135	"<span class=""chemical"">[chemical A]</span> contributes to or plays a role in <span class=""disease"">[disease P]</span>"	D010423_induces_D009408	"<span class=""chemical"">[chemical A]</span> contributes to or plays a role in <span class=""disease"">[disease Q]</span>"	D010423_induces_D009408|D020425	"<span class=""chemical"">[chemical A]</span> contributes to or plays a role in <span class=""disease"">[disease R]</span>"	D010423_induces_D005355|D009135	"<span class=""chemical"">[chemical A]</span> contributes to or plays a role in <span class=""disease"">[disease S]</span>"	empty	<strong>Do not</strong> choose this choice.	"<span class=""disease"">[disease S]</span> is a common, well-known side effect of repeated <span class=""chemical"">[chemical A]</span> injection. However, <span class=""disease"">[disease Q]</span> due to fibrotic muscle affected by <span class=""chemical"">[chemical A]</span>-induced <span class=""disease"">[disease P]</span> has not previously been reported. In a 37-year-old woman with documented <span class=""chemical"">[chemical A]</span>-induced <span class=""disease"">[disease S]</span> of triceps and deltoid muscles bilaterally and a three-week history of right wrist drop, electrodiagnostic examination showed a severe but partial lesion of the right radial nerve distal to the branches to the triceps, in addition to the <span class=""disease"">[disease S]</span>. Surgery revealed the right radial nerve to be severely compressed by the densely fibrotic lateral head of the triceps. Decompression and neurolysis were performed with good subsequent recovery of function."	"<span class=""disease"">[disease R]</span> due to <span class=""chemical"">[chemical A]</span>-induced <span class=""disease"">[disease S]</span>."	3800626	bcv_id_15
D011318_induces_D006319	"<span class=""chemical"">[chemical A]</span> contributes to or plays a role in <span class=""disease"">[disease P]</span>"	D011318_induces_D034381	"<span class=""chemical"">[chemical A]</span> contributes to or plays a role in <span class=""disease"">[disease Q]</span>"	D002045_induces_D006319	"<span class=""chemical"">[chemical B]</span> contributes to or plays a role in <span class=""disease"">[disease P]</span>"	D002045_induces_D034381	"<span class=""chemical"">[chemical B]</span> contributes to or plays a role in <span class=""disease"">[disease Q]</span>"	empty	<strong>Do not</strong> choose this choice.	"The cause of <span class=""disease"">[disease Q]</span> after spinal anaesthesia is unknown. Up until now, the only factor studied has been the effect of the diameter of the spinal needle on post-operative <span class=""disease"">[disease P]</span>. The aim of this study was to describe this <span class=""disease"">[disease Q]</span> and to investigate other factors influencing the degree of <span class=""disease"">[disease Q]</span>. Two groups of 22 similar patients were studied: one group received 6 mL <span class=""chemical"">[chemical A]</span> 2%; and the other received 3 mL <span class=""chemical"">[chemical B]</span> 0.5%. Patients given <span class=""chemical"">[chemical A]</span> were more likely to develop <span class=""disease"">[disease Q]</span> (10 out of 22) than those given <span class=""chemical"">[chemical B]</span> (4 out of 22) (P < 0.05). The average <span class=""disease"">[disease Q]</span> for speech frequencies was about 10 dB after <span class=""chemical"">[chemical A]</span> and 15 dB after <span class=""chemical"">[chemical B]</span>. None of the patients complained of subjective <span class=""disease"">[disease Q]</span>. Long-term follow-up of the patients was not possible."	"The effect of different anaesthetic agents in <span class=""disease"">[disease Q]</span> following spinal anaesthesia."	9522143	bcv_id_16
